[
  {
    "schemaVersion": 1,
    "recipeId": "rec_salmon_rice",
    "origin": "base",
    "currentVersionId": "recver_salmon_rice_v2_p4",
    "status": "active",
    "createdAt": "2026-09-03T12:00:00Z",
    "updatedAt": "2026-09-03T14:04:00Z"
  },
  {
    "schemaVersion": 1,
    "recipeId": "rec_zucchini_rice",
    "origin": "base",
    "currentVersionId": "recver_zucchini_rice_v1_p4",
    "status": "active",
    "createdAt": "2026-09-03T12:00:00Z",
    "updatedAt": "2026-09-03T14:04:00Z"
  },
  {
    "schemaVersion": 1,
    "recipeId": "rec_salmon_zucchini",
    "origin": "base",
    "currentVersionId": "recver_salmon_zucchini_v1_p4",
    "status": "active",
    "createdAt": "2026-09-03T12:00:00Z",
    "updatedAt": "2026-09-03T14:04:00Z"
  },
  {
    "schemaVersion": 1,
    "recipeId": "rec_4b7fe672e5b4ee6f8f2d",
    "origin": "base",
    "currentVersionId": "recver_4b7fe672e5b4ee6f8f2df2fd_v1",
    "status": "active",
    "createdAt": "2026-09-03T14:07:00Z",
    "updatedAt": "2026-09-03T14:07:00Z"
  }
]
